{
 "amazon": {
  "name": "Amazon Ads",
  "currencyNote": "Sales/Spend in INR; ACOS = Spend/Sales",
  "reports": [
   {
    "id": "exec",
    "title": "Account / Executive Performance",
    "level": "Day / week / month",
    "question": "How is Amazon advertising performing overall and is spend translating into sales?",
    "metrics": [
     "Spend",
     "Impressions",
     "Clicks",
     "CTR",
     "CPC",
     "Sales",
     "Orders",
     "Units",
     "ROAS",
     "ACOS",
     "Conversion rate",
     "New-to-brand"
    ],
    "representation": "KPI strip + trend lines (Spend, Sales, ROAS/ACOS); vertical bars for period comparison",
    "grid": false
   },
   {
    "id": "campaign",
    "title": "Campaign Performance",
    "level": "Campaign",
    "question": "Which campaigns are driving sales efficiently?",
    "metrics": [
     "Spend",
     "Impressions",
     "Clicks",
     "CTR",
     "CPC",
     "Sales",
     "Orders",
     "Units",
     "ROAS",
     "ACOS",
     "Conversion rate"
    ],
    "representation": "Campaign table + horizontal bars ranked by ROAS / Sales / Spend; trend line when a campaign is selected",
    "grid": "optional",
    "gridAxes": "Rows = campaigns; columns = selected KPI"
   },
   {
    "id": "asin",
    "title": "Product / ASIN Performance",
    "level": "Advertised product / ASIN",
    "question": "Which products are actually benefiting from advertising?",
    "metrics": [
     "Impressions",
     "Clicks",
     "Sales",
     "Orders",
     "Units",
     "Spend",
     "ROAS",
     "ACOS",
     "NTB sales"
    ],
    "representation": "Product table + horizontal bar ranking by Sales or ROAS; trend line for selected ASIN",
    "grid": true,
    "gridAxes": "Rows = ASINs; columns = ROAS / ACOS / Sales / Spend"
   },
   {
    "id": "search",
    "title": "Search Term Performance",
    "level": "Search term",
    "question": "Which shopper queries are generating or wasting spend?",
    "metrics": [
     "Search term",
     "Impressions",
     "Clicks",
     "CTR",
     "CPC",
     "Spend",
     "Orders",
     "Sales",
     "ROAS",
     "ACOS"
    ],
    "representation": "Search-term table + horizontal bars for Sales / Spend / ROAS; trend line for selected term",
    "grid": true,
    "gridAxes": "Rows = search terms; columns = CTR / CPC / ACOS / ROAS"
   },
   {
    "id": "targeting",
    "title": "Targeting / Keyword Performance",
    "level": "Keyword / product target",
    "question": "Which targets deserve more budget or bid attention?",
    "metrics": [
     "Target",
     "Match type",
     "Impressions",
     "Clicks",
     "CTR",
     "CPC",
     "Spend",
     "Orders",
     "Sales",
     "ROAS",
     "ACOS"
    ],
    "representation": "Targeting table + horizontal ranking bars; grid for target efficiency",
    "grid": true,
    "gridAxes": "Rows = targets; columns = Spend, Sales, ROAS, ACOS"
   },
   {
    "id": "placement",
    "title": "Placement Performance",
    "level": "Placement",
    "question": "Where on Amazon are ads performing best?",
    "metrics": [
     "Placement",
     "Impressions",
     "Clicks",
     "CTR",
     "CPC",
     "Spend",
     "Orders",
     "Sales",
     "ROAS",
     "ACOS"
    ],
    "representation": "Placement table + vertical bars for Sales/ROAS; trend line by placement",
    "grid": true,
    "gridAxes": "Rows = campaigns; columns = placements (top of search / rest of search / product pages); cells = ROAS or ACOS"
   },
   {
    "id": "budget",
    "title": "Budget & Pacing",
    "level": "Campaign / day",
    "question": "Are campaigns spending at the intended rate?",
    "metrics": [
     "Daily budget",
     "Spend",
     "Budget utilization %",
     "Remaining budget",
     "Impressions",
     "Clicks",
     "Sales",
     "ROAS",
     "ACOS"
    ],
    "representation": "Daily trend lines for spend vs budget; campaign table; vertical bars for budget utilization",
    "grid": true,
    "gridAxes": "Rows = campaigns; columns = dates; cells = spend-to-budget %"
   },
   {
    "id": "time",
    "title": "Performance Over Time",
    "level": "Day / week / month",
    "question": "How are spend, CPC and sales efficiency changing over time?",
    "metrics": [
     "Spend",
     "Clicks",
     "CPC",
     "Impressions",
     "Sales",
     "Orders",
     "ROAS",
     "ACOS"
    ],
    "representation": "Trend lines primary; KPI table below",
    "grid": false
   },
   {
    "id": "ntb",
    "title": "Brand / New-to-Brand",
    "level": "Campaign / brand / period",
    "question": "Is advertising acquiring new customers or mainly driving existing demand?",
    "metrics": [
     "NTB orders",
     "NTB sales",
     "NTB share",
     "Spend",
     "Sales",
     "ROAS",
     "ACOS"
    ],
    "representation": "KPI strip + vertical bars NTB vs non-NTB; trend line for NTB share",
    "grid": "optional",
    "gridAxes": "Rows = campaigns/periods; columns = NTB metrics"
   }
  ]
 },
 "flipkart": {
  "name": "Flipkart Ads",
  "currencyNote": "Revenue split into Direct / Indirect; PPV = product page views",
  "reports": [
   {
    "id": "exec",
    "title": "Account / Executive Performance",
    "level": "Day / week / month",
    "question": "How is retail-media spend translating into traffic and sales?",
    "metrics": [
     "Ad Spend",
     "Impressions",
     "Views",
     "Clicks",
     "CTR",
     "PPV",
     "ATC",
     "Orders/Units",
     "Revenue",
     "ROAS",
     "Direct Revenue",
     "Indirect Revenue"
    ],
    "representation": "KPI strip + trend lines (Spend, Revenue, ROAS); vertical bars for period comparison",
    "grid": false
   },
   {
    "id": "campaign",
    "title": "Campaign Performance",
    "level": "Campaign",
    "question": "Which campaigns are driving efficient sales?",
    "metrics": [
     "Ad Spend",
     "Impressions",
     "Views",
     "Clicks",
     "CTR",
     "PPV",
     "ATC",
     "Orders/Units",
     "Revenue",
     "ROAS",
     "Direct Revenue",
     "Indirect Revenue"
    ],
    "representation": "Campaign table + horizontal bars ranked by Revenue / ROAS / Spend; trend line for selected campaign",
    "grid": "optional"
   },
   {
    "id": "adgroup",
    "title": "Ad Group / Targeting Performance",
    "level": "Ad group / targeting",
    "question": "Which targeting and bidding groups are working?",
    "metrics": [
     "Impressions",
     "Views",
     "Clicks",
     "CTR",
     "PPV",
     "ATC",
     "Orders/Units",
     "Spend",
     "Revenue",
     "ROAS"
    ],
    "representation": "Table + horizontal bars; grid for efficiency comparison",
    "grid": true,
    "gridAxes": "Rows = ad groups; columns = ROAS / CTR / CPC / conversion"
   },
   {
    "id": "search",
    "title": "Search Term Performance",
    "level": "Actual search query",
    "question": "Which search queries are creating efficient demand?",
    "metrics": [
     "Search term",
     "Views",
     "Clicks",
     "CTR",
     "PPV",
     "ATC",
     "Orders/Units",
     "Spend",
     "Revenue",
     "ROAS"
    ],
    "representation": "Search-term table + horizontal bars; grid for search-term efficiency",
    "grid": true,
    "gridAxes": "Rows = search terms; columns = CTR / ROAS / Orders / Spend"
   },
   {
    "id": "keyword",
    "title": "Keyword Performance",
    "level": "Keyword + match type",
    "question": "Which targeted keywords are performing and which need attention?",
    "metrics": [
     "Keyword",
     "Match type",
     "Impressions/Views",
     "Clicks",
     "CTR",
     "Spend",
     "PPV",
     "ATC",
     "Orders/Units",
     "Revenue",
     "ROAS"
    ],
    "representation": "Keyword table + horizontal bars; grid by match type and performance",
    "grid": true,
    "gridAxes": "Rows = keywords; columns = match types or KPIs"
   },
   {
    "id": "placement",
    "title": "Placement Performance",
    "level": "Placement / page type",
    "question": "Which retail-media placements are most effective?",
    "metrics": [
     "Placement",
     "Impressions",
     "Views",
     "Clicks",
     "CTR",
     "PPV",
     "ATC",
     "Orders/Units",
     "Spend",
     "Revenue",
     "ROAS"
    ],
    "representation": "Placement table + vertical bars; placement grid",
    "grid": true,
    "gridAxes": "Rows = campaigns/ad groups; columns = Search / Browse / PDP / Homepage; cells = ROAS / CTR / Revenue"
   },
   {
    "id": "sku",
    "title": "Product / SKU Performance",
    "level": "Product / SKU / listing",
    "question": "Which advertised products are driving sales and where is spend inefficient?",
    "metrics": [
     "Impressions",
     "Clicks",
     "Spend",
     "PPV",
     "ATC",
     "Orders/Units",
     "Revenue",
     "ROAS",
     "SKU status"
    ],
    "representation": "Product table + horizontal bars for Revenue / ROAS; grid for product × campaign efficiency",
    "grid": true,
    "gridAxes": "Rows = products/SKUs; columns = campaigns or KPIs"
   },
   {
    "id": "adproduct",
    "title": "Channel / Ad Product Performance",
    "level": "Ad product",
    "question": "Which ad product is contributing to the business?",
    "metrics": [
     "Spend",
     "Impressions",
     "Views",
     "Clicks",
     "CTR",
     "Revenue",
     "Orders/Units",
     "ROAS",
     "Direct Revenue",
     "Indirect Revenue"
    ],
    "representation": "Vertical bars comparing Display / Sponsored Product / Product Contextual + KPI table",
    "grid": false
   },
   {
    "id": "budget",
    "title": "Budget & Wallet / Pacing",
    "level": "Campaign / ad account / day",
    "question": "Are campaigns pacing correctly and is available wallet funding sufficient?",
    "metrics": [
     "Budget",
     "Spend",
     "Budget utilization",
     "Wallet balance",
     "Blocked funds",
     "Redeemed spend",
     "Released funds",
     "Expiring funds"
    ],
    "representation": "Trend line spend vs budget + vertical bars for utilization + wallet table",
    "grid": true,